tag,patterns,responses,
Python,What is python?,"Python is a widely-used, interpreted, object-oriented, and high-level programming language with dynamic semantics, used for general-purpose programming. It was created by Guido van Rossum, and first released on February 20, 1991.",
Python,Python definition?,"Python is a popular programming language. It was created by Guido van Rossum, and released in 1991.
It is used for: web development (server-side), software development, mathematics, system scripting.",
Python,define python,"Python is a general-purpose interpreted, interactive, object-oriented, and high-level programming language. It was created by Guido van Rossum during 1985- 1990.",
Python,describe python?,"Python is a general purpose, dynamic, high-level, and interpreted programming language. It supports Object Oriented programming approach to develop applications. It is simple and easy to learn and provides lots of high-level data structures",
Python Characteristics,Discuss Python Characteristics and features,"Python is an easy language. It is easy to read, write, learn and understand. The Python language is designed to make developers life easy. Reading a Python code is like reading an English sentence. This is one of the key reason that makes Python best for beginners.",
Python Characteristics,Explain Python Characteristics and features,"Python is a dynamic, high level, free open source and interpreted programming language. It supports object-oriented programming as well as procedural oriented programming.",
Python Characteristics,What are some Python Characteristics and features,Python is a dynamically-typed language. You don’t need to declare data type while defining a variable. The interpreter determines this at runtime based on the types of the parts of the expression. This is easy for programmers.,
python founder and history,Who developed python,"The programming language Python was conceived in the late 1980s, and its implementation was started in December 1989 by Guido van Rossum at CWI in the Netherlands as a successor to ABC capable of exception handling and interfacing with the Amoeba operating system.",
python founder and history,father of python,Python was initially designed by Guido van Rossum in 1991 and developed by Python Software Foundation.,
python founder and history,year python was developed,Python laid its foundation in the late 1980s. The implementation of Python was started in December 1989 by Guido Van Rossum at CWI in Netherland.,
python founder and history,When did python development started,"Python was conceptualized in the late 1980s. Guido van Rossum worked that time in a project at the CWI, called Amoeba, a distributed operating system. ",
IDE,What is IDE,"An integrated development environment (IDE) is a software application that provides comprehensive facilities to computer programmers for software development.  Features of IDE are Text editor,Debugger,Compiler/Interpreter,Code completion,Programming language support,Code highlighting,Integrations and plugins,Source Code Management system integration",
IDE,Define IDE,"An IDE (or Integrated Development Environment) is a program dedicated to software development. As the name implies, IDEs integrate several tools specifically designed for software development.",
IDE,Explain python IDE,"Python code editors are designed for the developers to code and debug program easily. Using these Python IDEs(Integrated Development Environment), you can manage a large codebase and achieve quick deployment.",
common IDE,What are the common python IDE,"The common Python IDEs are PyCharm, Jupyter Notebook, Spyder, Sublime Text and Atom. ",
common IDE,Suggest common python IDE,"The common Python IDEs are PyCharm, Jupyter Notebook, Spyder, Sublime Text and Atom. There are even more IDEs which you can use to work with Python.",
Installation,How to install Python,Select the Latest version from the following links 1.Python Versions (Windows) : https://www.python.org/downloads/windows/ 2.Python Versions (Mac): https://www.python.org/downloads/mac-osx/,
Installation,Steps to install Python,"Python can be installed using this link, https://www.python.org/ or you can use anaconda distribution
Install a python package using pip or conda command
    eg: pip install <package_name>
          conda install <package_name>",
python comments,what are comments,Comments in Python can be used to explain Python code. Python comment is written by initializing the text of comment with a # and terminates when the end of line is encountered.,
python comments,Define comments,Python comments can be used to make the code more readable. Comments can be used to prevent execution when testing code.,
python comments,Explain comments,"Python comments are used for code documentation. Compilers and interpreters ignore comments. There are two type of comments : Single line (#) and Multi line ("""""" """""").",
python print function,Usage of print function,"The print() function prints the specified message to the screen, or other standard output device.This message can be a string, or any other object, the object will be converted into a string before written to the screen.",
python print function,print function in python,"The print() function prints the given object to the standard output device (screen) or to the text stream file. Example: print(""Hello"", ""how are you?"")",
python useful fields,Different fields where python is used,"Python is used in various fields like Data Science , Big Data, Artificial Intelligence, Web Programming , General-purpose Programming, Back-end Programming ,Automation Programming ,Raspberry Pi Programming ,IoT (Internet of Things) Programming",
python useful fields,Where can we use python,"Data Science , Big Data, Artificial Intelligence, Web Programming , General-purpose Programming, Back-end Programming ,Automation Programming ,Raspberry Pi Programming ,IoT (Internet of Things) Programming",
variables in python,Importance of variables,A variable is a name given to a memory location. It is the basic unit of storage in a program.Python is not “statically typed” so we do not need to declare variables before using them or declare their type. A variable is created the moment we first assign a value to it.,
variables in python,why variables are important,"Variables are containers for storing data values.Python has no command for declaring a variable.A variable is created the moment you first assign a value to it.

Variables are containers for storing data values.Python has no command for declaring a variable.A variable is created the moment you first assign a value to it.",
variables in python,define variables in python,"A Python variable is a reserved memory location to store values. In other words, a variable in a python program gives data to the computer for processing. Eg: We will define variable in Python and declare it as ""a"" and print it. a=100 print(a)
",
variables in python,what are variables in python,"Variable is a name that is used to refer to memory location. Python variable is also known as an identifier and used to hold value.In Python, we don't need to specify the type of variable because Python is a infer language and smart enough to get variable type.  ",
data types in python,Different data types in python,"Data types are the classification or categorization of data items. It represents the kind of value that tells what operations can be performed on a particular data. Following are the standard or built-in data type of Python: Numeric,String,Tuple,List,Dictionary,Float,Boolean",
data types in python,what are different variables in python,"Variables can store data of different types, and different types can do different things.Python has the following data types built-in by default, in these categories:String, set,Boolean,Numbers ,String,List,Tuple,Dictionary",
data types in python,What are different data types in python,"Every value in Python has a datatype. Since everything is an object in Python programming, data types are actually classes and variables are instance (object) of these classes.Some of the important types are listed below: String, Numbers,List,Tuple,Dictionary,Set,Boolean",
boolean datatype python,Explain boolean datatype in python,"Type of Python boolean type is one of the built-in data types provided by Python, which are defined by the True or False keywords. Generally, it is used to represent the truth values of the expressions. The output <class 'bool'> indicates the variable is a boolean data type.",
boolean datatype python,Boolean datatype in python,The Boolean data type is a data type that has one of two possible values (usually denoted true and false) which is intended to represent the two truth values of logic.,
boolean datatype python,what is a boolean datatype in python,"The boolean data type in python is any value which is either True or False.Boolean variables are defined by the True and False keywords. The bool() function allows you to evaluate any value, and give you True or False in return.",
Integer datatype in python,what are Integer datatypes in python,"In Python, integers are zero, positive or negative whole numbers without a fractional part and having unlimited precision, e.g. 0, 100, -10.Integers can be binary, octal, and hexadecimal values. All integer literals or variables are objects of the int class.",
Integer datatype in python,Integer datatypes in python,"Number data types store numeric values. They are immutable data types. This means, changing the value of a number data type results in a newly allocated object. Eg: var1 = 1",
Integer datatype in python,Explain Integer datatype in python,Integer datatype is represented by int class. It contains positive or negative whole numbers (without fraction or decimal). In Python there is no limit to how long an integer value can be. Ex: var a = 100,
float datatype in python,Explain float datatype in python,The float type in Python represents the floating point number. Float is used to represent real numbers and is written with a decimal point dividing the integer and fractional parts. Ex: a=50.90,
float datatype in python,Float datatype in python,The float type in Python designates a floating-point number. Float values are specified with a decimal point. Ex: a=4.2,
float datatype in python,Example of float datatype in python,"Float, or ""floating point number"" in python is a number, positive or negative, containing one or more decimals. Ex: x=0.9",
string datatype in python,what is a string datatype in python,"In python, strings are arrays of bytes represnting Unicode characters.Square brackets can be used to access elements of the string. Ex: str=""Python Programming Language""",
string datatype in python,Explain string datatype in python,"A string is a sequence of characters. A character is simply a symbol. In Python, a string is a sequence of Unicode characters. Strings in python are surrounded by either single quotation marks, or double quotation marks. Ex: str=""Python Programming Language""",
string datatype in python,String datatype in python,"
A string is a data type used in programming, such as an integer and floating point unit, but is used to represent text rather than numbers. Ex: str=""python""",
list in python,Explain list datatype in python,"In Python programming, a list is created by placing all the items (elements) inside square brackets [] , separated by commas. It can have any number of items and they may be of different types (integer, float, string etc.). A list can also have another list as an item. This is called a nested list.thislist = [""apple"", ""banana"", ""cherry""]
 ",
list in python,List in python,"Lists are used to store multiple items in a single variable.Lists are used to store multiple items in a single variable.ex: thislist = [""apple"", ""banana"", ""cherry""]",
list in python,List datatype in python,"A list is a collection of items in a particular order. You can make a list that
includes the letters of the alphabet, the digits from 0–9, or the names of
all the people in your family. List in Python are ordered and have a definite count. The elements in a list are indexed according to a definite sequence and the indexing of a list is done with 0 being the first index. Each element in the list has its definite place in the list, which allows duplicating of elements in the list, with each element having its own distinct place and credibility.
 A list is defined with square brackets [ ] 
Use commas between elements to separate them 
Lists are ordered and changeable
Lists allow duplicate members
Advanced Topic: Lists are nestable, you can add a list to a list",
Accessing items from a list,How can we access items from a list in python,"To access values in lists, use the square brackets for slicing along with the index or indices to obtain value available at that index. For example: list2 = [1, 2, 3, 4, 5, 6, 7 ];
print ""list1[0]: "", list1[0]",
Accessing items from a list,How can we access elements from a list in python,"Lists are ordered collections, so you can access any element in a list by telling Python the position, or index, of the item desired. To access an element in a list, write the name of the list followed by the index of the item enclosed in square brackets.bicycles = ['trek', 'cannondale', 'redline', 'specialized'] print(bicycles[0])
",
Accessing items from a list,How to access items from a list in python,"We can use the index operator [] to access an item in a list. In Python, indices start at 0. So, a list having 5 elements will have an index from 0 to 4.ex: my_list = ['p', 'r', 'o', 'b', 'e'], print(my_list[0]),# Output: p",
tuples in python,Explain tuples in python,"A Tuple is a collection of Python objects separated by commas. In someways a tuple is similar to a list in terms of indexing, nested objects and repetition but a tuple is immutable unlike lists which are mutable.",
tuples in python,what are tuples in python,"Tuples are used to store multiple items in a single variable. Tuple is one of 4 built-in data types in Python used to store collections of data, the other 3 are List, Set, and Dictionary, all with different qualities and usage. A tuple is a collection which is ordered and unchangeable.ex: tup1 = ('physics', 'chemistry', 1997, 2000);",
tuples in python,Tuples in python,"A tuple is a collection of objects which ordered and immutable. Tuples are sequences, just like lists. The differences between tuples and lists are, the tuples cannot be changed unlike lists and tuples use parentheses, whereas lists use square brackets.ex: tup1 = ('physics', 'chemistry', 1997, 2000);",
set in python,What is the use of set in python,"A Set is an unordered collection data type that is iterable, mutable and has no duplicate elements. Python's set class represents the mathematical notion of a set. thisset = {""apple"", ""banana"", ""cherry""}
print(thisset)",
set in python,Define set in python,"A Set is an unordered collection data type that is iterable, mutable and has no duplicate elements. Python’s set class represents the mathematical notion of a set. The major advantage of using a set, as opposed to a list, is that it has a highly optimized method for checking whether a specific element is contained in the set. thisset = {""apple"", ""banana"", ""cherry""}
print(thisset)",
set in python,What is set in python,"Sets are used to store multiple items in a single variable.A set is a collection which is both unordered and unindexed.Sets are written with curly brackets.ex: thisset = {""apple"", ""banana"", ""cherry""}
print(thisset)",
dictionary in python,Explain dictionary in python,"A dictionary in Python is a collection of key-value pairs. Each key is connected to a value, and you can use a key to access the value associated with that key.A key’s value can be a number, a string, a list, or even another dictionary. Eg: alien_0 = {'color': 'green', 'points': 5}",
dictionary in python,Define dictionariesin python,"Dictionary in Python is an ordered collection of data values, used to store data values like a map, which, unlike other Data Types that hold only a single value as an element, Dictionary holds key:value pair. Key-value is provided in the dictionary to make it more optimized. eg: thisdict = {
  ""brand"": ""Ford""} where key is brand and value is Ford",
dictionary in python,What is a dictionary in python,"A dictionary in Python is a collection of key-value pairs, that are unordered, changeable, and indexed.A dictionary is a collection which is ordered*, changeable and does not allow duplicates.Dictionaries are written with curly brackets, and have keys and values. eg: thisdict = {
  ""brand"": ""Ford""} where key is brand and value is Ford
",
primitive datatypes in python,Primitive Datatypes in python,"Dictionary in Python is an ordered collection of data values, used to store data values like a map, which, unlike other Data Types that hold only a single value as an element, Dictionary holds key:value pair. Key-value is provided in the dictionary to make it more optimized. eg: thisdict = {
  ""brand"": ""Ford""} where key is brand and value is Ford",
primitive datatypes in python,Define primitive data types,"Primitive data types are most primitive or the basic data structures. They are the building blocks for data manipulation and contain pure, simple values of a data. Python has four primitive variable types: Integer, Float, Strings, Boolean",
primitive datatypes in python,What are primitive data types,"The primitive data types are the building blocks for data manipulation and contain pure and simple values of data.Example of primitive data types:Boolean, Numbers,Strings,Float",
non-primitive datatypes in python,Define non-primitive data types,"Data types which are pre-defined and supported by the programming language are called as primitive datatypes.In python they can be classified as: String, Integer, Boolean, Float",
non-primitive datatypes in python,What are non- primitive data types in python,"Non-primitive types are the sophisticated members of the data structure family. They don't just store a value, but rather a collection of values in various formats.Example of non-primitive data types:Lists,Sets,Tuples,Dictionary,Files ",
non-primitive datatypes in python,Non-primitive data type,"Data types which are derived from the primitive data types and offer increased functionality can be defined as non-primitive data types .Example of non-primitive data types:Lists,Sets,Tuples,Dictionary,Files ",
python function,Functions in python,"
A function is a block of code that only runs when it is called. Python functions return a value using a return statement, if one is specified. A function can be called anywhere after the function has been declared. Syntax for python definition: def function_name:",
python function,What is the use of function in python,"A Python function is a group of code. To run the code in a function, you must call the function. A function can be called from anywhere after the function is defined. Functions can return a value using a return statement.Functions allow developers to reduce repetition in their code because they can execute the same block of code multiple times over in one program.Syntax for python definition: def function_name:",
python function,Why function is used in python,"A function is a block of code which only runs when it is called.You can pass data, known as parameters, into a function.A function can return data as a result.In Python a function is defined using the def keyword:Eg: def my_function():
 print(""Hello from a function"")",
function definition in python,How to define python function?,"A function is a block of code which only runs when it is called.In Python a function is defined using the def keyword. Eg: def my_function():
  print(""Hello from a function"")",
function definition in python,Defining python functions,"A function is a block of code which only runs when it is called.In Python a function is defined using the def keyword. Eg: def my_function():
  print(""Hello from a function"")",
function definition in python,Explain how a function can be defined in python?,"A function is a block of code which only runs when it is called.In Python a function is defined using the def keyword. Eg: def my_function():
  print(""Hello from a function"")",
global variable in python,what is global variable in python,"A global variable in python means having a scope throughout the program, i.e., a global variable value is accessible throughout the program unless shadowed. A global variable in Python is often declared as the top of the program. In other words, variables that are declared outside of a function are known as global variables.Syntax of global variable: X = “sampleGlobalValue” def function1():",
global variable in python,Explian python global variable,"A variable which can be accessed by the other block is called a global variable. It can be defined in outside a block. In other words, a global variable is defined outside the function, and we can access it inside the function.Syntax of global variable: X = “sampleGlobalValue” def function1():",
global variable in python,Define global variable in python,"Variables that are created outside of a function are known as global variables.Global variables can be used everywhere, both inside of functions and outside.Syntax of global variable: X = “sampleGlobalValue” def function1():",
for loop in python,for loop in python,"A for loop is used for iterating over a sequence (that is either a list, a tuple, a dictionary, a set, or a string).With the for loop we can execute a set of statements, once for each item in a list, tuple, set etc.Syntax of for loop : for x in ""banana"":
 print(x)",
for loop in python,syntax of for loop in python,"The for loop in python is used to iterate the statements or a part of the program several times. It is frequently used to traverse the data structures like list, tuple, or dictionary.Syntax of for loop : for x in ""banana"":
 print(x)",
for loop in python,for loop syntax in python,"A ""For"" Loop is used to repeat a specific block of code a known number of times. For example, if we want to check the grade of every student in the class, we loop from 1 to that number. Syntax of for loop: for x in ""banana"":
print(x)",
if loop in python,if loop in python,"If statement is the most simple decision making statement. It is used to decide whether a certain statement or block of statements will be executed or not i.e if a certain condition is true then a block of statement is executed otherwise not. Syntax: if condition:           
   # Statements to execute if
   # condition is true",
if loop in python,Syntax of if loop in python,"If statement is the most simple decision making statement. It is used to decide whether a certain statement or block of statements will be executed or not i.e if a certain condition is true then a block of statement is executed otherwise not. Syntax: if condition:                                                                                                                                                                                                                                                                                              # Statements to execute if
# condition is true",
if loop in python,python if loop,"If statement is the most simple decision making statement. It is used to decide whether a certain statement or block of statements will be executed or not i.e if a certain condition is true then a block of statement is executed otherwise not. Syntax: if condition:                                                                                                                                                                                                                                                                                              # Statements to execute if
# condition is true",
Encapsulation in python,what is Encapsulation in python,"Encapsulation is one of the fundamental concepts in object-oriented programming (OOP). It describes the idea of wrapping data and the methods that work on data within one unit. A class is an example of encapsulation as it encapsulates all the data that is member functions, variables, etc.",
Encapsulation in python,Encapsulation in python,"Using OOP in Python, we can restrict access to methods and variables. This prevents data from direct modification which is called encapsulation. ",
Encapsulation in python,Encapsulation in oops,"The process of wrapping up variables and methods into a single entity is known as Encapsulation. It is one of the underlying concepts in object-oriented programming (OOP). It acts as a protective shield that puts restrictions on accessing variables and methods directly, and can prevent accidental or unauthorized modification of data. Encapsulation also makes objects into more self-sufficient, independently functioning pieces.",
 Arithmetic Operators in python,what are the arithmetic operators in python?,"Arithmetic operators are used to perform mathematical operations like addition, subtraction, multiplication and division.There are 7 arithmetic operators in Python : Addition,Substraction,Multiplication,Division,Modulus,Exponentiation,Floor Division",
 Arithmetic Operators in python,arithmetic opertors in python,"Arithmetic operators are used to perform mathematical operations like addition, subtraction, multiplication and division.There are 7 arithmetic operators in Python : Addition,Substraction,Multiplication,Division,Modulus,Exponentiation,Floor Division",
